{
  "schema_version": "4.4.0",
  "task_id": "TASK-001",
  "candidate_revision": "0123456789abcdef",
  "baseline_digest": "77478e2a918e6dc7984f79534abcd5415cdbb07bb2c7de2346aceb03e5484f4f",
  "reviewer_role": "Frontend Engineering Reviewer",
  "independent": true,
  "scope": [
    "UI-REQ-005"
  ],
  "findings": [],
  "decision": "approve"
}
